{
  "schema_version": "plamen.mechanical_gate_migration_edits.provisional.v1",
  "status": "PROVISIONAL_UNWRAPPED_UNREVIEWED",
  "runtime_authority_granted": false,
  "authoritative_registry": {
    "path": "rules/mechanical-gate-registry.json",
    "sha256": "5acf9a848bae74ab256872600324098e1472bff73fdcb0233923f6c5dac5157e",
    "schema_version": "plamen.mechanical_gate_registry.v1"
  },
  "source_snapshot": {
    "source_tree_digest_algorithm": "sha256:plamen-source-tree-v1",
    "source_tree_digest": "605041aff4c9dc4cddf848af9fe71d7e7d5399487f9a89a7e2d624294489c9c6",
    "digest_stability": "REGENERATE_AT_TREE_FREEZE",
    "git_head": "67a0f85adc7a8169d79a286908b00bef7adb764a",
    "files": [
      {
        "path": "scripts/audit_snapshot.py",
        "sha256": "ea80ce08577f68eaad1d1b3c4d06c237d87e3a4d6db5fcda1435bb582561fe53"
      },
      {
        "path": "scripts/enumeration_gate.py",
        "sha256": "084b5604c8d48a1a321549bd987d66578a6cc86ce088402cd8162c92df14ec7c"
      },
      {
        "path": "scripts/mandatory_reverification.py",
        "sha256": "a786942c9efbd1e959969091f5ed5bb8def2246adcc042a7085f84de68690bad"
      },
      {
        "path": "scripts/mechanical_verify.py",
        "sha256": "c083898e011c7cb9a1f224edd3dda4b9fb40ec8f07465d355a64df7524418d2c"
      },
      {
        "path": "scripts/phase_io_contracts.py",
        "sha256": "ec4d4872f4f217a333fc0a5006b127a715b275bf69a402d9386f4a1ff662b9fd"
      },
      {
        "path": "scripts/plamen_driver.py",
        "sha256": "45aa2ebe92f85688e52f8886d6e75db17157d7d44bcbfa919cc4381ef51d3c69"
      },
      {
        "path": "scripts/plamen_mechanical.py",
        "sha256": "d24409338ef4d1a4c2a0b9e026b5f59f4521ec6ca8c2c56027e543e7c8abdf72"
      },
      {
        "path": "scripts/plamen_validators.py",
        "sha256": "20e4c437670d4e3c7575bcd5c360a59b96070870b7cc95e791901208c0fa7313"
      },
      {
        "path": "scripts/post_verify_lifecycle.py",
        "sha256": "fbc67412f5ca9a54c5d775bf2d4d2fb2db75985e5e1248e34e27827b7996142f"
      },
      {
        "path": "scripts/recon_prepass.py",
        "sha256": "86d1adca34a61c22fef34876b21573b854892ef1a7b98076890a3fa9037653c8"
      },
      {
        "path": "scripts/report_disposition_authority.py",
        "sha256": "46624f1f5f131d0e293c4421c4e3cebc14ccd486a671716ee4997f5052e6fbc2"
      },
      {
        "path": "scripts/supply_chain_gate.py",
        "sha256": "929c6aa88978907050a2b5e16e8d2c8a6037f15adf58a9d12ffd519b42bb420c"
      }
    ]
  },
  "independent_review_receipt_sha256": null,
  "gate_count": 33,
  "edit_entries": [
    {
      "forensic_id": "MG-001",
      "gate_id": "supply_chain.pre_input_execution",
      "activation_id": "supply_chain.pre_input_execution.recon_prepass",
      "runtime_readiness": "TARGET_EXECUTION_CIRCUIT_BREAKER_REQUIRED",
      "edit_targets": [
        {
          "module": "scripts/recon_prepass.py",
          "symbol": "_prepare_evm_build",
          "edit_kind": "INLINE_LITERAL_RUNTIME_CIRCUIT_BREAKER",
          "source_lines": [
            2134
          ]
        }
      ],
      "phase_io_binding": {
        "status": "ABSENT_DEDICATED_CONTRACT",
        "phase": null,
        "work_unit_id": null,
        "owner_key_binding": null,
        "input_artifact_identities": [],
        "output_artifact_identities": []
      },
      "migration_debt_codes": [
        "DEDICATED_PHASE_IO_CONTRACT_ABSENT",
        "LITERAL_RUNTIME_REGISTRATION_ABSENT",
        "TARGET_EXECUTION_PRESTATE_NOT_BOUND"
      ],
      "existing_code_edit_authorized": false
    },
    {
      "forensic_id": "MG-002",
      "gate_id": "supply_chain.pre_poc_execution",
      "activation_id": "supply_chain.pre_poc_execution.mechanical_verify",
      "runtime_readiness": "TARGET_EXECUTION_CIRCUIT_BREAKER_REQUIRED",
      "edit_targets": [
        {
          "module": "scripts/mechanical_verify.py",
          "symbol": "run_phase5b_mechanical_verify",
          "edit_kind": "INLINE_LITERAL_RUNTIME_CIRCUIT_BREAKER",
          "source_lines": [
            2101,
            2216
          ]
        }
      ],
      "phase_io_binding": {
        "status": "ABSENT_DEDICATED_CONTRACT",
        "phase": null,
        "work_unit_id": null,
        "owner_key_binding": null,
        "input_artifact_identities": [],
        "output_artifact_identities": []
      },
      "migration_debt_codes": [
        "DEDICATED_PHASE_IO_CONTRACT_ABSENT",
        "LITERAL_RUNTIME_REGISTRATION_ABSENT",
        "TARGET_EXECUTION_PRESTATE_NOT_BOUND"
      ],
      "existing_code_edit_authorized": false
    },
    {
      "forensic_id": "MG-003",
      "gate_id": "snapshot.startup_binding",
      "activation_id": "snapshot.startup_binding.driver",
      "runtime_readiness": "NEEDS_GATE_RECEIPT_AND_WRAPPER",
      "edit_targets": [
        {
          "module": "scripts/plamen_driver.py",
          "symbol": "main",
          "edit_kind": "WRAP_CONTEXT_MANAGER_ENTRY_WITH_LITERAL_RUNTIME",
          "source_lines": [
            66850
          ]
        }
      ],
      "phase_io_binding": {
        "status": "ABSENT_DEDICATED_CONTRACT",
        "phase": null,
        "work_unit_id": null,
        "owner_key_binding": null,
        "input_artifact_identities": [],
        "output_artifact_identities": []
      },
      "migration_debt_codes": [
        "DEDICATED_PHASE_IO_CONTRACT_ABSENT",
        "LITERAL_RUNTIME_REGISTRATION_ABSENT"
      ],
      "existing_code_edit_authorized": false
    },
    {
      "forensic_id": "MG-004",
      "gate_id": "snapshot.interphase_drift",
      "activation_id": "snapshot.interphase_drift.driver",
      "runtime_readiness": "NEEDS_GATE_RECEIPT_AND_WRAPPER",
      "edit_targets": [
        {
          "module": "scripts/plamen_driver.py",
          "symbol": "_assert_audit_snapshot_still_bound",
          "edit_kind": "WRAP_EXISTING_ENTRY_WITH_LITERAL_RUNTIME",
          "source_lines": [
            61939,
            65256,
            67325
          ]
        }
      ],
      "phase_io_binding": {
        "status": "ABSENT_DEDICATED_CONTRACT",
        "phase": null,
        "work_unit_id": null,
        "owner_key_binding": null,
        "input_artifact_identities": [],
        "output_artifact_identities": []
      },
      "migration_debt_codes": [
        "DEDICATED_PHASE_IO_CONTRACT_ABSENT",
        "EXACT_RUNTIME_PHASE_SELECTOR_UNBOUND",
        "LITERAL_RUNTIME_REGISTRATION_ABSENT"
      ],
      "existing_code_edit_authorized": false
    },
    {
      "forensic_id": "MG-005",
      "gate_id": "enumeration.graph_health",
      "activation_id": "enumeration.graph_health.accepted_depth",
      "runtime_readiness": "NEEDS_GATE_RECEIPT_AND_WRAPPER",
      "edit_targets": [
        {
          "module": "scripts/enumeration_gate.py",
          "symbol": "_record_graph_health",
          "edit_kind": "RETURN_TYPED_GRAPH_HEALTH_EVALUATION",
          "source_lines": [
            666,
            769,
            792,
            808
          ]
        }
      ],
      "phase_io_binding": {
        "status": "ABSENT_DEDICATED_CONTRACT",
        "phase": null,
        "work_unit_id": null,
        "owner_key_binding": null,
        "input_artifact_identities": [],
        "output_artifact_identities": []
      },
      "migration_debt_codes": [
        "DEDICATED_PHASE_IO_CONTRACT_ABSENT",
        "LITERAL_RUNTIME_REGISTRATION_ABSENT",
        "SHARED_COVERAGE_SHORTFALL_OUTPUT_NOT_GATE_BOUND"
      ],
      "existing_code_edit_authorized": false
    },
    {
      "forensic_id": "MG-006",
      "gate_id": "enumeration.coreference_obligation",
      "activation_id": "enumeration.coreference_obligation.accepted_depth",
      "runtime_readiness": "NEEDS_GATE_RECEIPT_AND_WRAPPER",
      "edit_targets": [
        {
          "module": "scripts/enumeration_gate.py",
          "symbol": "run_enumeration_gate",
          "edit_kind": "INLINE_LITERAL_TYPED_EVALUATION",
          "source_lines": [
            5688,
            5701
          ]
        }
      ],
      "phase_io_binding": {
        "status": "ABSENT_DEDICATED_CONTRACT",
        "phase": null,
        "work_unit_id": null,
        "owner_key_binding": null,
        "input_artifact_identities": [],
        "output_artifact_identities": []
      },
      "migration_debt_codes": [
        "DEDICATED_PHASE_IO_CONTRACT_ABSENT",
        "EXACT_DENOMINATOR_RECEIPT_ABSENT",
        "LITERAL_RUNTIME_REGISTRATION_ABSENT"
      ],
      "existing_code_edit_authorized": false
    },
    {
      "forensic_id": "MG-007",
      "gate_id": "enumeration.coreference_gap",
      "activation_id": "enumeration.coreference_gap.accepted_depth",
      "runtime_readiness": "NEEDS_GATE_RECEIPT_AND_WRAPPER",
      "edit_targets": [
        {
          "module": "scripts/enumeration_gate.py",
          "symbol": "validate_enumeration_coverage",
          "edit_kind": "WRAP_EXISTING_ENTRY_WITH_LITERAL_RUNTIME",
          "source_lines": [
            1348,
            5706
          ]
        }
      ],
      "phase_io_binding": {
        "status": "ABSENT_DEDICATED_CONTRACT",
        "phase": null,
        "work_unit_id": null,
        "owner_key_binding": null,
        "input_artifact_identities": [],
        "output_artifact_identities": []
      },
      "migration_debt_codes": [
        "DEDICATED_PHASE_IO_CONTRACT_ABSENT",
        "EXACT_DENOMINATOR_RECEIPT_ABSENT",
        "LITERAL_RUNTIME_REGISTRATION_ABSENT"
      ],
      "existing_code_edit_authorized": false
    },
    {
      "forensic_id": "MG-008",
      "gate_id": "enumeration.critical_asset_mover",
      "activation_id": "enumeration.critical_asset_mover.accepted_depth",
      "runtime_readiness": "NEEDS_GATE_RECEIPT_AND_WRAPPER",
      "edit_targets": [
        {
          "module": "scripts/enumeration_gate.py",
          "symbol": "compute_critical_asset_mover_candidates",
          "edit_kind": "WRAP_FUNCTION_ENTRY_AVOID_DYNAMIC_DISPATCH_ALIAS",